{
  "$schema": "https://json-schema.org/draft-07/schema#",
  "$id": "https://jnap.me/contracts/intel-graph/intake-event.schema.json",
  "title": "Intel Graph Intake Event",
  "type": "object",
  "additionalProperties": false,
  "required": ["schema_version", "kind", "id", "event_type", "occurred_at", "actor", "target"],
  "properties": {
    "schema_version": { "type": "integer", "const": 1 },
    "kind": { "type": "string", "const": "intake_event" },
    "id": { "type": "string", "pattern": "^[A-Za-z0-9][A-Za-z0-9:._-]*$" },
    "event_type": {
      "type": "string",
      "enum": ["discovered", "opened", "read", "saved", "dismissed", "annotated", "cited", "shared"]
    },
    "occurred_at": { "type": "string", "format": "date-time" },
    "actor": {
      "type": "object",
      "additionalProperties": false,
      "required": ["type", "id"],
      "properties": {
        "type": { "type": "string", "enum": ["user", "agent", "importer"] },
        "id": { "type": "string", "minLength": 1 }
      }
    },
    "target": {
      "type": "object",
      "additionalProperties": false,
      "required": ["kind", "id"],
      "properties": {
        "kind": { "type": "string", "enum": ["source", "work", "annotation", "topic", "entity", "claim"] },
        "id": { "type": "string", "minLength": 1 }
      }
    },
    "source": {
      "type": "object",
      "additionalProperties": false,
      "properties": {
        "surface": { "type": "string" },
        "url": { "type": "string", "format": "uri" }
      }
    },
    "metadata": {
      "type": "object",
      "additionalProperties": true
    }
  }
}

